{
  "profileId": "product-control-plane",
  "contractVersion": "0.4.0",
  "contractDigest": "34614ac71512dab0816b0f3c0be0b4ece382e56c9a867ae5bd78f0126c512c62",
  "trustDomain": "product",
  "deliveryStream": "product-delivery",
  "enabledContracts": [
    "externalWorkItemRef",
    "promotionBundle",
    "contextAssemblyManifest",
    "deliveryEvent",
    "deliveryManifest",
    "terminalReport",
    "ssotProjection"
  ],
  "externalProjectionMode": "read-only",
  "stateStoreOwnership": "consumer",
  "humanGates": ["merge", "deployment", "publication", "permissions"]
}
