{
  "profileId": "personal-control-plane",
  "contractVersion": "0.3.0",
  "contractDigest": "3311d9e2bbe8fae5dcf0165f7536351609d3dde8cb2806eb370fb2e42cbb5985",
  "trustDomain": "personal",
  "deliveryStream": "personal-delivery",
  "enabledContracts": [
    "externalWorkItemRef",
    "promotionBundle",
    "contextAssemblyManifest",
    "deliveryEvent",
    "deliveryManifest",
    "terminalReport"
  ],
  "externalProjectionMode": "read-only",
  "stateStoreOwnership": "consumer",
  "humanGates": ["promotion", "merge", "release", "permissions"]
}
